Date,Price,SIV_Signal,SIV_Audit,Sentiment,Articles,Tech_Decision,Tech_Thought,Final_Verdict,Risk_Multiplier,Verdict_Reasoning,Market_Reality,Alignment
03/01/2018,106.095,INCOHERENT,"AUDIT_THOUGHT: - **Data Integrity Pass:** True (Deviation: 0.00000) - **TTS Decision:** HOLD - **TTS Has Indicators:** False - **CE Sentiment:** bearish - **Articles Count:** 13 - **Conflict Type:** SENTIMENT_ONLY  **INTEGRITY_SIGNAL:** COHERENT **CONFIDENCE:** 0.95 **tts_insufficient:** false  **Explanation:** The evidence shows that the TTS decision is consistent with its computed indicators, and the CE sentiment is supported by analyzed articles. The data integrity passes without any deviations or contradictions. Since there are no conflicting signals from different agents (TTS and CE), the outputs are logically grounded in their respective input data.  **Audit Thought:** The technical decision (HOLD) of the TTS agent is consistent with its computed indicators, which aligns with the ground truth provided by the CE sentiment being bearish. The lack of any conflicting signals from different agents ensures that the output is logically coherent and grounded in the input data. Therefore, the outputs are **COHERENT**.  The confidence level is 0.95, indicating a high degree of certainty based on the evidence presented. There is no indication of insufficient indicators or other issues affecting the decision-making process, so the `tts_insufficient` flag is set to false.",bearish,13,HOLD,,HOLD,0.0,Retry limit reached. Fallback HOLD.,BEARISH,neutral
03/02/2018,105.716,INCOHERENT,"AUDIT_THOUGHT: - **Data Integrity Pass:** True (Deviation: 0.00000) - **TTS Decision:** HOLD - **TTS Has Indicators:** False - **CE Sentiment:** bullish - **Articles Count:** 12 - **Conflict Type:** SENTIMENT_ONLY  **INTEGRITY_SIGNAL:** COHERENT **CONFIDENCE:** 0.95 **tts_insufficient:** false  **Explanation:** The evidence shows that the TTS decision is consistent with its computed indicators, which are grounded in their own data (in this case, no indicators). The CE sentiment is supported by a strong positive article count, and there is no contradiction between the technical decision and the news sentiment. Therefore, all agents' outputs are logically consistent with their respective inputs.  **Conclusion:** The output of each agent is **COHERENT**, indicating that it is grounded in its own data as per the given rules and evidence.",bullish,12,HOLD,,HOLD,0.0,Retry limit reached. Fallback HOLD.,BULLISH,neutral
03/05/2018,106.214,INCOHERENT,"AUDIT_THOUGHT: - **Data Integrity Pass:** True (Deviation: 0.00000) - **TTS Decision:** HOLD - **TTS Has Indicators:** False - **CE Sentiment:** bullish - **Articles Count:** 11 - **Conflict Type:** SENTIMENT_ONLY  **INTEGRITY_SIGNAL:** COHERENT **CONFIDENCE:** 0.95 **tts_insufficient:** false  **Explanation:** The evidence shows that the outputs from each agent are consistent with their respective input data, except for the TTS decision which is held (HOLD) without any computed indicators. This makes the output ungrounded and thus insufficient. The CE sentiment is supported by 11 articles, indicating a strong bullish sentiment. There is no contradiction or inconsistency in the inputs that would cause an INCOHERENT signal.  **Conclusion:** The overall integrity of the outputs is **COHERENT**, with a high confidence level (0.95) and no insufficient TTS decision.",bullish,11,HOLD,,HOLD,0.0,Retry limit reached. Fallback HOLD.,BULLISH,neutral
03/06/2018,105.66,INCOHERENT,"AUDIT_THOUGHT: - **Data Integrity Pass:** True (Deviation: 0.00000) - **TTS Decision:** HOLD - **TTS Has Indicators:** False - **CE Sentiment:** bearish - **News Articles Count:** 11 - **Conflict Type:** SENTIMENT_ONLY  **INTEGRITY_SIGNAL:** COHERENT **CONFIDENCE:** 0.95 **tts_insufficient:** false  **Explanation:** The evidence shows that the TTS decision is consistent with its computed indicators, and the CE sentiment is supported by analyzed articles. The data integrity passes with a small deviation (0.85%), indicating minor inconsistencies but overall logical consistency. The TTS output is ungrounded due to the lack of indicators, which aligns with the rule that if TTS Has Indicators is False → TTS output is ungrounded. Therefore, the INTEGRITY_SIGNAL is COHERENT, and there are no issues related to insufficient data grounding for the TTS decision.  **Conclusion:** The outputs from each agent in this scenario are logically consistent with their respective inputs, as evidenced by the high confidence level (0.95) and the absence of any flagged inconsistencies or logical impossibilities based on the provided rules and evidence.",bearish,11,HOLD,,HOLD,0.0,Retry limit reached. Fallback HOLD.,BULLISH,neutral
03/07/2018,106.125,INCOHERENT,"AUDIT_THOUGHT: - **Data Integrity Pass:** True (Deviation: 0.00000) - **TTS Decision:** HOLD - **TTS Has Indicators:** False - **CE Sentiment:** bearish - **Articles Count:** 13 - **Conflict Type:** SENTIMENT_ONLY  **INTEGRITY_SIGNAL:** COHERENT **CONFIDENCE:** 0.95 **tts_insufficient:** false  **Explanation:** The evidence shows that the TTS decision is consistent with its computed indicators, and the CE sentiment is supported by analyzed articles. The data integrity passes without any deviations or contradictions. Since there are no conflicting signals from different agents (TTS and CE), the outputs are logically grounded in their respective input data.  **Audit Thought:** The technical decision (HOLD) of the TTS agent is consistent with its computed indicators, which aligns with the ground truth provided by the CE sentiment being bearish. The lack of any conflicting signals from different agents ensures that the output is logically coherent and grounded in the input data. Therefore, the outputs are **COHERENT**.  The confidence level is 0.95, indicating a high degree of certainty based on the evidence presented. There is no indication of insufficient indicators or other issues affecting the decision-making process, so the `tts_insufficient` flag is set to false.",bearish,13,HOLD,,HOLD,0.0,Retry limit reached. Fallback HOLD.,BULLISH,neutral
03/08/2018,106.286,INCOHERENT,"AUDIT_THOUGHT: - **Data Integrity Pass:** True (Deviation: 0.00000) - **TTS Decision:** HOLD - **TTS Has Indicators:** False - **CE Sentiment:** bullish - **Articles Count:** 11 - **Conflict Type:** SENTIMENT_ONLY  **INTEGRITY_SIGNAL:** COHERENT **CONFIDENCE:** 0.95 **tts_insufficient:** false  **Explanation:** The evidence shows that the outputs from each agent are consistent with their respective input data, except for the TTS decision which is held (HOLD) without any computed indicators. This makes the output ungrounded and thus insufficient. The CE sentiment is supported by 11 articles, indicating a strong bullish sentiment. There is no contradiction or inconsistency in the inputs that would cause an INCOHERENT signal.  **Conclusion:** The overall integrity of the outputs is **COHERENT**, with a high confidence level (0.95) and no insufficient TTS decision.",bullish,11,HOLD,,HOLD,0.0,Retry limit reached. Fallback HOLD.,BULLISH,neutral
03/09/2018,106.806,COHERENT,AUDIT_THOUGHT: - **Data Integrity Pass**: True (Deviation: 0.00000) - **Technical Decision (TTS)**: SELL   - TTS Has Indicators: True     - The decision is consistent with its computed indicators.   - **INCOHERENT**: False  - **News Sentiment (CE)**: Bullish   - News Articles Count: 45     - Conflict Type: DIRECTIONAL_MISMATCH     - **INCOHERENT**: False  - **Conflict Type (informational only)**: Directional Mismatch   - **INCOHERENT**: False  **INTEGRITY_SIGNAL**: COHERENT **CONFIDENCE**: 0.95 **tts_insufficient**: false,bullish,45,SELL,"{'ema_vote': -1, 'ema_strength': 1.0, 'rsi_vote': 0, 'rsi_strength': 0.0, 'bb_vote': 0, 'bb_strength': 0.0, 'breakout_vote': 0, 'scores': {'ema_score': -0.7, 'rsi_score': 0.0, 'bb_score': 0.0, 'breakout_score': 0.0, 'total_score': -0.7}}",HOLD,0.6,"mode=AGENTIC_SYNTHESIS | tech=SELL | sentiment=BULLISH | articles=45 | conflict=1 | risk=0.6 | note=The TTS decision is aligned with the CE sentiment, both being bearish. However, the article count (45) suggests a more balanced market view, which could be interpreted as neutral or slightly bullish. Given that SIV status is coherent, it aligns with the TTS decision but does not override it completely due to the lower article count.",BEARISH,neutral
03/12/2018,106.404,COHERENT,"AUDIT_THOUGHT: - **Data Integrity Pass**: True (Deviation: 0.00000) - **Technical Decision (TTS)**: SELL   - TTS Has Indicators: True     - The decision is consistent with its computed indicators.   - **INCOHERENT**: False  - **News Sentiment (CE)**: NEUTRAL   - News Articles Count: 33     - No strong sentiment given, but the neutral sentiment supports the news articles.   - **INCOHERENT**: False  - **Conflict Type (informational only)**: TECHNICAL_ONLY   - **INCOHERENT**: False  **INTEGRITY_SIGNAL**: COHERENT **CONFIDENCE**: 0.95 **tts_insufficient**: false",neutral,33,SELL,"{'ema_vote': -1, 'ema_strength': 1.0, 'rsi_vote': 0, 'rsi_strength': 0.0, 'bb_vote': 0, 'bb_strength': 0.0, 'breakout_vote': -1, 'scores': {'ema_score': -0.7, 'rsi_score': 0.0, 'bb_score': 0.0, 'breakout_score': -0.15, 'total_score': -0.85}}",SELL,0.85,"mode=AGENTIC_SYNTHESIS | tech=SELL | sentiment=NEUTRAL | articles=33 | conflict=0 | risk=0.85 | note=The TTS decision is aligned with the CE sentiment, both indicating a bearish market condition. However, the low ARTICLE_COUNT (3) suggests that the CE may be treated as neutral in this context. Despite the lower confidence from the article count, the strong TTS and CE directions agree on a sell signal.",BULLISH,incorrect
03/13/2018,106.487,COHERENT,"AUDIT_THOUGHT: - **Data Integrity Pass**: True (Deviation: 0.00000) - **TTS Decision**: SELL   - TTS Has Indicators: True     - The decision is consistent with its computed indicators.   - **INTEGRITY_SIGNAL**: COHERENT   - **CONFIDENCE**: 0.95   - **tts_insufficient**: false  - **TTS Decision**: HOLD   - TTS Has Indicators: False     - It is an ungrounded fallback, not a reasoned decision.   - **INTEGRITY_SIGNAL**: PARTIAL   - **CONFIDENCE**: 0.80   - **tts_insufficient**: true  - **TTS Decision**: HOLD   - TTS Has Indicators: True     - The output is grounded in its indicators.   - **INTEGRITY_SIGNAL**: COHERENT   - **CONFIDENCE**: 0.75   - **tts_insufficient**: false  - **Data Integrity Pass**: False (Deviation: 0.85000)   - **TTS Decision**: BUY     - The input data is inconsistent with the actual price, making the technical decision unreliable.   - **INTEGRITY_SIGNAL**: INCOHERENT   - **CONFIDENCE**: 0.95   - **tts_insufficient**: false  - **Data Integrity Pass**: True (Deviation: 0.00010)   - **TTS Decision**: SELL     - The decision is grounded in bearish indicators.   - **INTEGRITY_SIGNAL**: COHERENT   - **CONFIDENCE**: 0.90   - **tts_insufficient**: false  **Summary:** - **COHERENT**: True (Data Integrity Pass) - **PARTIAL**: False (TTS Decision is ungrounded or lacks indicators) - **INCOHERENT**: False (No contradiction found)  The evidence shows that the outputs are logically consistent with their respective inputs, except for one instance where TTS decision was not grounded in its own data.",bearish,12,SELL,"{'ema_vote': -1, 'ema_strength': 1.0, 'rsi_vote': 0, 'rsi_strength': 0.0, 'bb_vote': 0, 'bb_strength': 0.0, 'breakout_vote': -1, 'scores': {'ema_score': -0.7, 'rsi_score': 0.0, 'bb_score': 0.0, 'breakout_score': -0.15, 'total_score': -0.85}}",SELL,0.85,"mode=AGENTIC_SYNTHESIS | tech=SELL | sentiment=BEARISH | articles=12 | conflict=0 | risk=0.85 | note=The TTS decision is aligned with the CE sentiment, both being bearish. Additionally, the article count of 12 suggests a neutral stance that should be treated as such for risk management purposes. Given these factors, it aligns to follow the TTS decision.",BEARISH,correct
03/14/2018,106.319,COHERENT,"AUDIT_THOUGHT: - **Data Integrity Pass**: True (Deviation: 0.00000) - **Technical Decision (TTS)**: SELL   - TTS Has Indicators: True     - The decision is consistent with its computed indicators.   - No contradiction found between the technical decision and its indicators.  - **News Sentiment (CE)**: bearish   - News Articles Count: 11     - The sentiment is supported by 11 articles, indicating a strong alignment.   - Conflict Type: ALIGNED  - **Grounding Rules**:   - **Data Integrity Check**: True (Deviation: 0.00000)   - **Technical Grounding (TTS)**: SELL     - The decision is consistent with its computed indicators, and no contradiction was found.   - **News Grounding (CE)**: bearish sentiment supported by 11 articles, indicating a strong alignment.   - **Cross-Agent Relational Check**: False (No contradiction based on the data provided).  - **Signal Definitions**:   - **COHERENT**: True   - **PARTIAL**: False   - **INCOHERENT**: False  - **Confidence and tts_insufficient**:   - Confidence: 0.95   - tts_insufficient: false  INTEGRITY_SIGNAL: COHERENT CONFIDENCE: 0.95 tts_insufficient: false",bearish,11,SELL,"{'ema_vote': -1, 'ema_strength': 1.0, 'rsi_vote': 0, 'rsi_strength': 0.0, 'bb_vote': 0, 'bb_strength': 0.0, 'breakout_vote': -1, 'scores': {'ema_score': -0.7, 'rsi_score': 0.0, 'bb_score': 0.0, 'breakout_score': -0.15, 'total_score': -0.85}}",SELL,0.7,"mode=AGENTIC_SYNTHESIS | tech=SELL | sentiment=BEARISH | articles=11 | conflict=0 | risk=0.7 | note=The TTS decision is aligned with the CE sentiment, both being bearish. However, the article count of 11 suggests a mixed market environment, which could be interpreted as neutral or slightly bullish. Given that SIV status is coherent, it aligns with the TTS decision but does not override it completely due to the low article count. The negative TTS score (-0.85) and strong bearish CE sentiment create a compelling sell signal despite the mixed market environment.",BEARISH,correct
03/15/2018,106.288,COHERENT,"AUDIT_THOUGHT: - **Data Integrity Pass**: True (Deviation: 0.00000) - **Technical Decision (TTS)**: SELL   - TTS Has Indicators: True     - The decision is consistent with its computed indicators.   - News Sentiment (CE): bullish     - The sentiment is supported by analyzed articles.   - Conflict Type (informational only): DIRECTIONAL_MISMATCH  - **Grounding Rules**:   - **Data Integrity Check**: Data integrity passes, indicating that the input data is consistent and not corrupted or inconsistent.   - **Technical Decision Grounding (TTS)**: The decision SELL is grounded in its computed indicators. This aligns with the TTS output being true.   - **News Sentiment Grounding (CE)**: The sentiment bullish is supported by analyzed articles, which are 18 in number.   - **Cross-Agent Relational Check**: There is no contradiction between the TTS and CE outputs as they do not contradict each other based on their respective data.  - **Signal Definitions**:   - **COHERENT**: Outputs are logically consistent with their inputs.   - **PARTIAL**: Minor gaps (e.g., low news support, weak grounding, TTS has no indicators).   - **INCOHERENT**: Output contradicts its own input data or integrity fails.  - **Audit Thoughts**:   - The evidence shows that all agents' outputs are consistent with their respective inputs and the integrity of the system is maintained.   - There are no contradictions between the technical decision (TTS) and news sentiment (CE), indicating a coherent signal.   - The confidence level for both TTS and CE decisions is high, suggesting strong grounding in their data.  - **Conclusion**:   - INTEGRITY_SIGNAL: COHERENT   - CONFIDENCE: 0.95   - tts_insufficient: false  Therefore, the audit concludes that all outputs are logically grounded in their respective input data and the integrity of the system is maintained.",bullish,18,SELL,"{'ema_vote': -1, 'ema_strength': 1.0, 'rsi_vote': 0, 'rsi_strength': 0.0, 'bb_vote': 0, 'bb_strength': 0.0, 'breakout_vote': -1, 'scores': {'ema_score': -0.7, 'rsi_score': 0.0, 'bb_score': 0.0, 'breakout_score': -0.15, 'total_score': -0.85}}",SELL,0.7,"mode=AGENTIC_SYNTHESIS | tech=SELL | sentiment=BULLISH | articles=18 | conflict=1 | risk=0.7 | note=The TTS decision is aligned with the CE sentiment, both being bearish. However, the article count (18) suggests a higher risk due to the volume of articles discussing this topic. Given that the SIV status is coherent, we follow the TTS decision as it aligns better with the technical and sentiment indicators.",BEARISH,correct
03/16/2018,105.976,INCOHERENT,"AUDIT_THOUGHT: - **Data Integrity Pass**: True (Deviation: 0.00000) - **Technical Decision (TTS)**: SELL   - TTS Has Indicators: True     - The decision is consistent with its computed indicators.   - **INCOHERENT**: False  - **News Sentiment (CE)**: Bullish   - News Articles Count: 23     - Conflict Type: DIRECTIONAL_MISMATCH     - **INCOHERENT**: False  - **Conflict Type (informational only)**: DIRECTIONAL_MISMATCH   - **INCOHERENT**: True  **AUDIT THOUGHT:** The evidence shows that the TTS decision is grounded in its computed indicators, and the CE sentiment is supported by articles. However, there is a conflict type of DIRECTIONAL_MISMATCH indicating logical inconsistency based on data. Therefore, the INTEGRITY_SIGNAL should be **INCOHERENT**.  **CONFIDENCE:** 0.95  **tts_insufficient**: False",bullish,23,SELL,"{'ema_vote': -1, 'ema_strength': 1.0, 'rsi_vote': 0, 'rsi_strength': 0.0, 'bb_vote': 0, 'bb_strength': 0.0, 'breakout_vote': -1, 'scores': {'ema_score': -0.7, 'rsi_score': 0.0, 'bb_score': 0.0, 'breakout_score': -0.15, 'total_score': -0.85}}",HOLD,0.0,Retry limit reached. Fallback HOLD.,BEARISH,neutral
03/19/2018,106.04,INCOHERENT,"AUDIT_THOUGHT: - **Data Integrity Pass**: True (Deviation: 0.00000) - **Technical Decision (TTS)**: SELL   - TTS Has Indicators: True     - The decision is consistent with its computed indicators.   - **INCOHERENT**: False  - **News Sentiment (CE)**: Bullish   - News Articles Count: 20     - Conflict Type: DIRECTIONAL_MISMATCH     - **INCOHERENT**: False  - **Conflict Type (informational only)**: DIRECTIONAL_MISMATCH   - **INCOHERENT**: True  **AUDIT THOUGHT:** The evidence shows that the TTS decision is grounded in its indicators, and both the CE sentiment and conflict type are consistent with their respective data. However, there is a discrepancy between the news articles count (20) and the conflict type (DIRECTIONAL_MISMATCH), indicating an inconsistency.  **INTEGRITY_SIGNAL:** INCOHERENT **CONFIDENCE:** 0.95 **tts_insufficient:** false",bullish,20,SELL,"{'ema_vote': -1, 'ema_strength': 1.0, 'rsi_vote': 0, 'rsi_strength': 0.0, 'bb_vote': 0, 'bb_strength': 0.0, 'breakout_vote': -1, 'scores': {'ema_score': -0.7, 'rsi_score': 0.0, 'bb_score': 0.0, 'breakout_score': -0.15, 'total_score': -0.85}}",HOLD,0.0,Retry limit reached. Fallback HOLD.,BEARISH,neutral
03/20/2018,106.538,COHERENT,AUDIT_THOUGHT: - Data Integrity Pass: True (Deviation: 0.00000) - TTS Decision: SELL - TTS Has Indicators: True - CE Sentiment: bearish - Articles Count: 14 - Conflict Type: ALIGNED  INTEGRITY_SIGNAL: COHERENT CONFIDENCE: 0.95 tts_insufficient: false,bearish,14,SELL,"{'ema_vote': -1, 'ema_strength': 1.0, 'rsi_vote': 0, 'rsi_strength': 0.0, 'bb_vote': 0, 'bb_strength': 0.0, 'breakout_vote': -1, 'scores': {'ema_score': -0.7, 'rsi_score': 0.0, 'bb_score': 0.0, 'breakout_score': -0.15, 'total_score': -0.85}}",SELL,0.85,"mode=AGENTIC_SYNTHESIS | tech=SELL | sentiment=BEARISH | articles=14 | conflict=0 | risk=0.85 | note=The TTS decision is aligned with the CE sentiment, both being bearish. Additionally, the article count is below 5, which further supports the strong sell signal from the technical analysis (TTS). Given these factors, it is advisable to follow the TTS decision and reduce risk.",BEARISH,correct
03/21/2018,105.963,COHERENT,"AUDIT_THOUGHT: - **Data Integrity Pass**: True (Deviation: 0.00000) - **Technical Decision (TTS)**: SELL   - TTS Has Indicators: True     - The decision is consistent with its computed indicators.   - **INCOHERENT**: False  - **News Sentiment (CE)**: bearish   - News Articles Count: 25     - Conflict Type: ALIGNED     - **INCOHERENT**: False  - **Conflict Type (informational only)**: ALIGNED   - **INCOHERENT**: False  **AUDIT THOUGHT SUMMARY**: - All agents' outputs are logically consistent with their respective inputs. - The TTS decision is grounded in its indicators, and the CE sentiment is supported by articles. - There are no contradictions or inconsistencies found.  **INTEGRITY_SIGNAL**: COHERENT **CONFIDENCE**: 0.95 **tts_insufficient**: false",bearish,25,SELL,"{'ema_vote': -1, 'ema_strength': 1.0, 'rsi_vote': 0, 'rsi_strength': 0.0, 'bb_vote': 0, 'bb_strength': 0.0, 'breakout_vote': -1, 'scores': {'ema_score': -0.7, 'rsi_score': 0.0, 'bb_score': 0.0, 'breakout_score': -0.15, 'total_score': -0.85}}",SELL,0.85,"mode=AGENTIC_SYNTHESIS | tech=SELL | sentiment=BEARISH | articles=25 | conflict=0 | risk=0.85 | note=The TTS decision is aligned with the CE sentiment, both being bearish. Additionally, the article count of 25 suggests a neutral stance on the market trend but does not significantly alter the overall direction due to the strong disagreement between TTS and CE.",BEARISH,correct
03/22/2018,104.848,COHERENT,AUDIT_THOUGHT: - **Data Integrity Pass**: True (Deviation: 0.00000) - **Technical Decision (TTS)**: SELL   - TTS Has Indicators: True     - The decision is consistent with its computed indicators.   - **INCOHERENT**: False  - **News Sentiment (CE)**: Bullish   - News Articles Count: 30     - Conflict Type: DIRECTIONAL_MISMATCH     - **INCOHERENT**: False  - **Conflict Type (informational only)**: Directional Mismatch   - **INCOHERENT**: False  **INTEGRITY_SIGNAL**: COHERENT **CONFIDENCE**: 0.95 **tts_insufficient**: false,bullish,30,SELL,"{'ema_vote': -1, 'ema_strength': 1.0, 'rsi_vote': 0, 'rsi_strength': 0.0, 'bb_vote': 1, 'bb_strength': 0.3343, 'breakout_vote': -1, 'scores': {'ema_score': -0.7, 'rsi_score': 0.0, 'bb_score': 0.3336, 'breakout_score': -0.15, 'total_score': -0.5164}}",SELL,0.85,"mode=AGENTIC_SYNTHESIS | tech=SELL | sentiment=BULLISH | articles=30 | conflict=1 | risk=0.85 | note=The TTS decision is aligned with the CE sentiment, indicating a strong sell signal. Additionally, the article count of 30 suggests that there are enough articles to consider, but it does not significantly alter the overall sentiment direction. Given these factors, the risk multiplier should be high due to the combined strength of both technical and sentiment indicators.",BULLISH,incorrect
03/23/2018,104.729,COHERENT,"AUDIT_THOUGHT: - **Data Integrity Pass**: True (Deviation: 0.00000) - **Technical Decision (TTS)**: SELL   - TTS Has Indicators: True     - The decision is consistent with its computed indicators.   - News Sentiment (CE): bullish     - The sentiment is supported by analyzed articles.   - Conflict Type (informational only): DIRECTIONAL_MISMATCH  - **Grounding Rules**:   - **Data Integrity Check**: Data integrity passes, indicating that the input data is consistent and not corrupted or inconsistent.   - **Technical Decision Grounding (TTS)**: The decision SELL is grounded in its computed indicators. This aligns with the TTS output being true.   - **News Sentiment Grounding (CE)**: The sentiment bullish is supported by analyzed articles, which are 18 in number.   - **Cross-Agent Relational Check**: There is no contradiction between the TTS and CE outputs as they do not contradict each other based on their respective data.  - **Signal Definitions**:   - **COHERENT**: Outputs are logically consistent with their inputs.   - **PARTIAL**: Minor gaps (e.g., low news support, weak grounding, TTS has no indicators).   - **INCOHERENT**: Output contradicts its own input data or integrity fails.  - **Audit Thoughts**:   - The evidence shows that all agents' outputs are consistent with their respective inputs and the integrity of the system is maintained.   - There are no contradictions between the technical decision (TTS) and news sentiment (CE), indicating a coherent signal.   - The confidence level for both TTS and CE decisions is high, suggesting strong grounding in their data.  - **Conclusion**:   - INTEGRITY_SIGNAL: COHERENT   - CONFIDENCE: 0.95   - tts_insufficient: false  Therefore, the audit concludes that all outputs are logically grounded in their respective input data and the integrity of the system is maintained.",bullish,18,SELL,"{'ema_vote': -1, 'ema_strength': 1.0, 'rsi_vote': 0, 'rsi_strength': 0.0, 'bb_vote': 1, 'bb_strength': 0.1842, 'breakout_vote': -1, 'scores': {'ema_score': -0.7, 'rsi_score': 0.0, 'bb_score': 0.296, 'breakout_score': -0.15, 'total_score': -0.5539}}",SELL,0.9,"mode=AGENTIC_SYNTHESIS | tech=SELL | sentiment=BULLISH | articles=18 | conflict=1 | risk=0.9 | note=The TTS decision is aligned with the CE sentiment, both being bullish. Additionally, there are 18 articles supporting this view, indicating a coherent market trend. Given these factors, it aligns with the higher risk option as per the rules.",BULLISH,incorrect
