Date,Price,SIV_Signal,SIV_Audit,Sentiment,Articles,Tech_Decision,Tech_Thought,Final_Verdict,Risk_Multiplier,Verdict_Reasoning,Market_Reality,Alignment
03/26/2018,105.452,COHERENT,AUDIT_THOUGHT: - Data Integrity Pass: True (Deviation: 0.00000) - TTS Decision: SELL - TTS Has Indicators: True - CE Sentiment: bearish - Articles Count: 3 - Conflict Type: ALIGNED  INTEGRITY_SIGNAL: COHERENT CONFIDENCE: 0.95 tts_insufficient: false,bearish,3,SELL,"{'ema_vote': -1, 'ema_strength': 1.0, 'rsi_vote': 0, 'rsi_strength': 0.0, 'bb_vote': 0, 'bb_strength': 0.0, 'breakout_vote': -1, 'scores': {'ema_score': -0.7, 'rsi_score': 0.0, 'bb_score': 0.0, 'breakout_score': -0.15, 'total_score': -0.85}}",SELL,0.85,"mode=AGENTIC_SYNTHESIS | tech=SELL | sentiment=BEARISH | articles=3 | conflict=0 | risk=0.85 | note=The TTS decision is aligned with the CE sentiment, both being bearish. However, the article count of 3 suggests a neutral stance on the market's overall direction. Given that SIV status is coherent, it aligns with the TTS decision to sell. Despite the low article count, the strong bearish sentiment from both technical and sentiment indicators outweighs the uncertainty provided by the short article count.",BULLISH,incorrect
03/27/2018,105.398,COHERENT,"AUDIT_THOUGHT: - **Data Integrity Pass (Deviation: 0.00000)**: The data integrity passes, indicating that the inputs are consistent and reliable.    - **TTS Decision (SELL)**: The TTS decision is ""SELL"" based on the technical indicators computed from the input data. This output is grounded in the indicators derived from the input data.  - **TTS Has Indicators (True)**: The TTS has computed indicators, which are consistent with the decision to sell. Therefore, there is no need to set `tts_insufficient` to true.  - **News Sentiment (Bullish)**: The CE sentiment is ""bullish,"" and it is supported by 5 news articles. This output is grounded in the input data through the analysis of the articles.  - **Conflict Type (Directional Mismatch)**: There is a conflict type of ""DIRECTIONAL_MISMATCH"" indicating that there is an inconsistency between the TTS decision and the CE sentiment, but this does not automatically make the signal INCOHERENT. The disagreement can be logically explained based on the data provided.  - **Grounding Rules**: All outputs are consistent with their respective input data, thus they meet the criteria for a COHERENT output.  INTEGRITY_SIGNAL: COHERENT CONFIDENCE: 0.95 tts_insufficient: false  The evidence above is consistent and logically grounded in its respective inputs, resulting in an INCOHERENT signal with a confidence level of 0.95 and no insufficient indication for the TTS decision.",bullish,5,SELL,"{'ema_vote': -1, 'ema_strength': 1.0, 'rsi_vote': 0, 'rsi_strength': 0.0, 'bb_vote': 0, 'bb_strength': 0.0, 'breakout_vote': -1, 'scores': {'ema_score': -0.7, 'rsi_score': 0.0, 'bb_score': 0.0, 'breakout_score': -0.15, 'total_score': -0.85}}",SELL,0.85,"mode=AGENTIC_SYNTHESIS | tech=SELL | sentiment=BULLISH | articles=5 | conflict=1 | risk=0.85 | note=The TTS decision is aligned with the CE sentiment, both being bearish. However, the article count (5) suggests a moderate level of market consensus against selling. Given that the risk multiplier for aligning signals is higher than the risk multiplier for holding or reducing risk, we will follow the TTS decision.",BULLISH,incorrect
03/28/2018,106.82,COHERENT,"AUDIT_THOUGHT: - **Data Integrity Pass (Deviation: 0.00000)**: The data integrity passes, indicating that the inputs are consistent and reliable.    - **TTS Decision (SELL)**: The TTS decision is ""SELL"" based on the technical indicators computed from the input data. This output is grounded in the indicators derived from the input data.  - **TTS Has Indicators (True)**: The TTS has computed indicators, which are consistent with the decision to sell. Therefore, there is no need to set `tts_insufficient` to true.  - **News Sentiment (Bullish)**: The CE sentiment is ""bullish,"" and it is supported by 5 news articles. This output is grounded in the input data through the analysis of the articles.  - **Conflict Type (Directional Mismatch)**: There is a conflict type of ""DIRECTIONAL_MISMATCH"" indicating that there is an inconsistency between the TTS decision and the CE sentiment, but this does not automatically make the signal INCOHERENT. The disagreement can be logically explained based on the data provided.  - **Grounding Rules**: All outputs are consistent with their respective input data, thus they meet the criteria for a COHERENT output.  INTEGRITY_SIGNAL: COHERENT CONFIDENCE: 0.95 tts_insufficient: false  The evidence above is consistent and logically grounded in its respective inputs, resulting in an INCOHERENT signal with a confidence level of 0.95 and no insufficient indication for the TTS decision.",bullish,5,SELL,"{'ema_vote': -1, 'ema_strength': 1.0, 'rsi_vote': 0, 'rsi_strength': 0.0, 'bb_vote': 0, 'bb_strength': 0.0, 'breakout_vote': 0, 'scores': {'ema_score': -0.7, 'rsi_score': 0.0, 'bb_score': 0.0, 'breakout_score': 0.0, 'total_score': -0.7}}",HOLD,0.5,"mode=AGENTIC_SYNTHESIS | tech=SELL | sentiment=BULLISH | articles=5 | conflict=1 | risk=0.5 | note=The TTS decision is aligned with the CE sentiment, both being bearish. However, the article count (5) suggests a moderate level of market activity, which could indicate that the current trend might be more complex than initially thought. Given this mixed signal and the lower risk multiplier compared to the previous example, it's prudent to hold rather than execute a sell order.",BEARISH,neutral
03/29/2018,106.481,COHERENT,"AUDIT_THOUGHT: - **Data Integrity Pass (Deviation: 0.00000)**: The data integrity check passes, indicating that the input data is consistent and reliable.    - **Technical Decision (TTS): SELL**:   - TTS Has Indicators: True → This output is grounded in its computed indicators.   - News Sentiment (CE): Bullish   - Articles Count: 13   - Conflict Type: DIRECTIONAL_MISMATCH    The decision to sell aligns with the bullish sentiment from the news articles, which supports this direction. There are no contradictions or inconsistencies between the TTS output and its indicators.  - **News Sentiment (CE)**:   - CE Sentiment: Bullish   - Articles Count: 13   - Conflict Type: DIRECTIONAL_MISMATCH    The bullish sentiment is supported by a substantial number of articles, indicating strong backing from market data. This further supports the grounded nature of the output.  - **Technical Decision (TTS) and News Sentiment (CE)**:   - TTS Output: SELL   - CE Sentiment: Bullish   - Articles Count: 13    The decision to sell aligns with a bullish sentiment, which is supported by strong market evidence. There are no contradictions or inconsistencies between the technical output and the news sentiment.  - **Confidence**:   Confidence levels can be inferred from the reasoning provided. In this case, both TTS and CE outputs are grounded in their respective data sources, leading to high confidence scores of 0.95 for COHERENT and 0.90 for PARTIAL.  - **tts_insufficient**: False  INTEGRITY_SIGNAL: COHERENT CONFIDENCE: 0.95 tts_insufficient: false",bullish,13,SELL,"{'ema_vote': -1, 'ema_strength': 1.0, 'rsi_vote': 0, 'rsi_strength': 0.0, 'bb_vote': 0, 'bb_strength': 0.0, 'breakout_vote': -1, 'scores': {'ema_score': -0.7, 'rsi_score': 0.0, 'bb_score': 0.0, 'breakout_score': -0.15, 'total_score': -0.85}}",HOLD,0.6,"mode=AGENTIC_SYNTHESIS | tech=SELL | sentiment=BULLISH | articles=13 | conflict=1 | risk=0.6 | note=The TTS decision is aligned with the CE sentiment, both being bearish. However, the article count of 13 suggests a mixed market sentiment, which could be interpreted as neutral or slightly bullish. Given that SIV status is coherent, it aligns with the TTS and CE decisions. Therefore, following the rule to defer to the TTS decision due to lower confidence in the CE sentiment.",BULLISH,neutral
03/30/2018,106.248,INCOHERENT,"AUDIT_THOUGHT: - **Data Integrity Pass**: True (Deviation: 0.00000) - **Technical Decision (TTS)**: SELL   - TTS Has Indicators: True     - The decision is consistent with its computed indicators.   - **INCOHERENT**: False  - **News Sentiment (CE)**: Bullish   - News Articles Count: 9     - Conflict Type: DIRECTIONAL_MISMATCH     - **INCOHERENT**: False  - **Conflict Type (informational only)**: Directional Mismatch   - **INCOHERENT**: True  **AUDIT THOUGHT:** The evidence shows that the TTS decision is grounded in its computed indicators, and the CE sentiment is supported by articles. However, there is a conflict type indicating an inconsistency between the two agents' outputs. This suggests that while the data integrity passes for each agent individually, their outputs are not logically consistent with each other.  **INTEGRITY_SIGNAL:** INCOHERENT **CONFIDENCE:** 0.95 **tts_insufficient:** False",bullish,9,SELL,"{'ema_vote': -1, 'ema_strength': 1.0, 'rsi_vote': 0, 'rsi_strength': 0.0, 'bb_vote': 0, 'bb_strength': 0.0, 'breakout_vote': -1, 'scores': {'ema_score': -0.7, 'rsi_score': 0.0, 'bb_score': 0.0, 'breakout_score': -0.15, 'total_score': -0.85}}",HOLD,0.0,Retry limit reached. Fallback HOLD.,BULLISH,neutral
